[
  {
    "name": "sma",
    "display_name": "Simple Moving Average",
    "description": "Простое скользящее среднее вычисляется как среднее арифметическое цен закрытия за определенный период. Используется для сглаживания колебаний цены и определения направления тренда.",
    "category": "trend",
    "complexity": "basic",
    "parameters_schema": {
      "type": "object",
      "required": ["timeperiod"],
      "properties": {
        "timeperiod": {
          "type": "integer",
          "minimum": 2,
          "maximum": 200,
          "default": 20,
          "description": "Период для расчета скользящего среднего"
        }
      }
    },
    "output_schema": {
      "type": "object",
      "properties": {
        "value": {
          "type": "number",
          "description": "Значение простого скользящего среднего"
        }
      }
    },
    "key_template": "{name}_timeperiod_{timeperiod}_value",
    "is_enabled": true,
    "frontend_config": {
      "icon": "trending-up",
      "color": "#2196F3",
      "chart_type": "line",
      "parameter_groups": [
        {
          "name": "Основные параметры",
          "parameters": ["timeperiod"]
        }
      ]
    }
  },
  {
    "name": "ema",
    "display_name": "Exponential Moving Average",
    "description": "Экспоненциальное скользящее среднее придает больший вес недавним ценам, что делает его более чувствительным к изменениям цены по сравнению с простым скользящим средним.",
    "category": "trend",
    "complexity": "basic",
    "parameters_schema": {
      "type": "object",
      "required": ["timeperiod"],
      "properties": {
        "timeperiod": {
          "type": "integer",
          "minimum": 2,
          "maximum": 200,
          "default": 20,
          "description": "Период для расчета экспоненциального скользящего среднего"
        }
      }
    },
    "output_schema": {
      "type": "object",
      "properties": {
        "value": {
          "type": "number",
          "description": "Значение экспоненциального скользящего среднего"
        }
      }
    },
    "key_template": "{name}_timeperiod_{timeperiod}_value",
    "is_enabled": true,
    "frontend_config": {
      "icon": "trending-up",
      "color": "#FF9800",
      "chart_type": "line",
      "parameter_groups": [
        {
          "name": "Основные параметры",
          "parameters": ["timeperiod"]
        }
      ]
    }
  },
  {
    "name": "rsi",
    "display_name": "Relative Strength Index",
    "description": "Индекс относительной силы измеряет скорость и изменение ценовых движений. RSI колеблется между 0 и 100, где значения выше 70 обычно считаются зоной перекупленности, а ниже 30 - зоной перепроданности.",
    "category": "momentum",
    "complexity": "basic",
    "parameters_schema": {
      "type": "object",
      "required": ["timeperiod"],
      "properties": {
        "timeperiod": {
          "type": "integer",
          "minimum": 2,
          "maximum": 50,
          "default": 14,
          "description": "Период для расчета RSI"
        }
      }
    },
    "output_schema": {
      "type": "object",
      "properties": {
        "value": {
          "type": "number",
          "description": "Значение индекса относительной силы (0-100)",
          "range": {
            "min": 0,
            "max": 100
          }
        }
      }
    },
    "key_template": "{name}_timeperiod_{timeperiod}_value",
    "is_enabled": true,
    "frontend_config": {
      "icon": "activity",
      "color": "#9C27B0",
      "chart_type": "line",
      "parameter_groups": [
        {
          "name": "Основные параметры",
          "parameters": ["timeperiod"]
        }
      ]
    }
  },
  {
    "name": "macd",
    "display_name": "Moving Average Convergence/Divergence",
    "description": "MACD показывает связь между двумя скользящими средними цены актива. Состоит из линии MACD, сигнальной линии и гистограммы. Используется для определения тренда и моментума.",
    "category": "momentum",
    "complexity": "intermediate",
    "parameters_schema": {
      "type": "object",
      "required": ["fastperiod", "slowperiod", "signalperiod"],
      "properties": {
        "fastperiod": {
          "type": "integer",
          "minimum": 2,
          "maximum": 50,
          "default": 12,
          "description": "Период быстрого экспоненциального скользящего среднего"
        },
        "slowperiod": {
          "type": "integer",
          "minimum": 5,
          "maximum": 100,
          "default": 26,
          "description": "Период медленного экспоненциального скользящего среднего"
        },
        "signalperiod": {
          "type": "integer",
          "minimum": 2,
          "maximum": 50,
          "default": 9,
          "description": "Период сигнальной линии"
        }
      }
    },
    "output_schema": {
      "type": "object",
      "properties": {
        "macd": {
          "type": "number",
          "description": "Значение линии MACD"
        },
        "signal": {
          "type": "number",
          "description": "Значение сигнальной линии"
        },
        "hist": {
          "type": "number",
          "description": "Значение гистограммы MACD"
        }
      }
    },
    "key_template": "{name}_fastperiod_{fastperiod}_signalperiod_{signalperiod}_slowperiod_{slowperiod}_{output_key}",
    "is_enabled": true,
    "frontend_config": {
      "icon": "bar-chart-2",
      "color": "#4CAF50",
      "chart_type": "line",
      "parameter_groups": [
        {
          "name": "Периоды скользящих средних",
          "parameters": ["fastperiod", "slowperiod"]
        },
        {
          "name": "Сигнальная линия",
          "parameters": ["signalperiod"]
        }
      ]
    }
  },
  {
    "name": "adx",
    "display_name": "Average Directional Movement Index",
    "description": "Индекс среднего направленного движения измеряет силу тренда без учета его направления. Значения выше 25 обычно указывают на сильный тренд, ниже 20 - на слабый тренд или боковое движение.",
    "category": "trend",
    "complexity": "intermediate",
    "parameters_schema": {
      "type": "object",
      "required": ["timeperiod"],
      "properties": {
        "timeperiod": {
          "type": "integer",
          "minimum": 5,
          "maximum": 50,
          "default": 14,
          "description": "Период для расчета ADX"
        }
      }
    },
    "output_schema": {
      "type": "object",
      "properties": {
        "value": {
          "type": "number",
          "description": "Значение индекса ADX (0-100)",
          "range": {
            "min": 0,
            "max": 100
          }
        }
      }
    },
    "key_template": "{name}_timeperiod_{timeperiod}_value",
    "is_enabled": true,
    "frontend_config": {
      "icon": "trending-up",
      "color": "#FF5722",
      "chart_type": "line",
      "parameter_groups": [
        {
          "name": "Основные параметры",
          "parameters": ["timeperiod"]
        }
      ]
    }
  },
  {
    "name": "supertrend",
    "display_name": "SuperTrend",
    "description": "SuperTrend - это индикатор следования за трендом, который использует Average True Range (ATR) для вычисления динамических уровней поддержки и сопротивления. Показывает направление тренда и потенциальные точки входа/выхода.",
    "category": "trend",
    "complexity": "advanced",
    "parameters_schema": {
      "type": "object",
      "required": ["length", "multiplier"],
      "properties": {
        "length": {
          "type": "integer",
          "minimum": 5,
          "maximum": 50,
          "default": 10,
          "description": "Период для расчета ATR"
        },
        "multiplier": {
          "type": "number",
          "minimum": 1.0,
          "maximum": 10.0,
          "default": 3.0,
          "description": "Множитель ATR для расчета полос SuperTrend"
        }
      }
    },
    "output_schema": {
      "type": "object",
      "properties": {
        "trend": {
          "type": "number",
          "description": "Текущее значение линии тренда SuperTrend"
        },
        "direction": {
          "type": "number",
          "description": "Направление тренда (1 для бычьего, -1 для медвежьего)"
        },
        "long": {
          "type": "number",
          "description": "Значение верхней полосы SuperTrend (для длинных позиций)"
        },
        "short": {
          "type": "number",
          "description": "Значение нижней полосы SuperTrend (для коротких позиций)"
        }
      }
    },
    "key_template": "{name}_length_{length}_multiplier_{multiplier}_{output_key}",
    "is_enabled": true,
    "frontend_config": {
      "icon": "arrow-up-circle",
      "color": "#E91E63",
      "chart_type": "overlay",
      "parameter_groups": [
        {
          "name": "Основные параметры",
          "parameters": ["length", "multiplier"]
        }
      ]
    }
  },
  {
    "name": "bbands",
    "display_name": "Bollinger Bands",
    "description": "Полосы Боллинджера состоят из центральной линии (скользящее среднее) и двух полос, расположенных на определенном расстоянии от нее. Используются для определения уровней перекупленности/перепроданности и волатильности.",
    "category": "volatility",
    "complexity": "intermediate",
    "parameters_schema": {
      "type": "object",
      "required": ["timeperiod", "nbdevup", "nbdevdn"],
      "properties": {
        "timeperiod": {
          "type": "integer",
          "minimum": 5,
          "maximum": 100,
          "default": 20,
          "description": "Период скользящего среднего"
        },
        "nbdevup": {
          "type": "number",
          "minimum": 0.5,
          "maximum": 5.0,
          "default": 2.0,
          "description": "Количество стандартных отклонений для верхней полосы"
        },
        "nbdevdn": {
          "type": "number",
          "minimum": 0.5,
          "maximum": 5.0,
          "default": 2.0,